Номер,Название,Цена
1,Диван прямой Филс-Мини 120 Velvet Terra,31890
2,Диван прямой Мелоу Velvet Eclipse,60490
3,Диван прямой Лилт Bucle Silver,93490
4,Диван угловой Нордика мини Velvet Yellow,65990
5,Диван прямой Спейс Velvet Olive,74790
6,Диван прямой Аронт Мини Velvet Smoke,63790
7,Диван прямой Массе-М Мини Velvet Navy Blue,54990
8,Диван прямой Нумо-Мини 120 Textile Light,29690
9,Диван прямой Клаймар Velvet Terra,69290
10,Диван прямой Лонди Bunny Milk,60490
11,Диван прямой Льери Мини Velvet Yellow,71490
12,Диван прямой Эби Velvet Coral,73690
13,Диван модульный Риббл-1 Bucle Mint,86880
14,Диван прямой Виена Velvet Smoke,71490
15,Диван модульный Brera-7 Velour Mix,196870
16,Диван угловой Эдвин Velvet Terra,87990
17,Диван угловой Аллаум Linia Stone,62690
18,Диван модульный Спейс-М 5 Lazy Midnight,204540
19,Диван прямой Сваут Velvet Mustard,75890
20,Диван угловой Аронт Мини Velvet Pink,65990
21,Диван модульный Маиль-3 Textile Latte,191370
22,Диван прямой Инес Vertical Blue,52790
23,Диван угловой Дарол Velvet Silver,76990
24,Диван угловой Нордика мини Velvet Coral,65990
25,Диван прямой Бонент Velvet Eclipse,92390
26,Диван прямой Эби Мини Linia Mint,65990
27,Диван прямой Роттердам Velvet Yellow,31890
28,Диван прямой Бруквиль Velvet Blue,60490
29,Диван прямой Слипсон Мини Linia Stone,52790
30,Диван угловой Динс Velvet Navy Blue,71490
31,Диван прямой Кейсес Velvet Grey,29690
32,Диван прямой Стаус Velvet Caramel,32990
33,Диван прямой Види Textile Ocean,27490
34,Диван прямой Бонс-Т Velvet Emerald,43990
35,Диван прямой Виенсо Bucle Sand,87990
36,Диван прямой Лави Velvet Yellow,43990
37,Диван прямой Риен Velvet Smoke,65990
38,Диван угловой Вильен мини Velvet Terra,70390
39,Диван прямой Пайпел Bucle Grafit,65990
40,Диван прямой Мейлон Velvet Beige,62690
41,Диван прямой Марей Soft Grey,108890
42,Диван прямой Сорен Textile Yellow,76990
43,Диван прямой Лачи Velvet Yellow,38490
44,Диван прямой Данста Velvet Light,71490
45,Диван угловой Шера Velvet Olive,120990
46,Диван прямой Викс Textile Grafit,27490
47,Диван прямой Нумо Velvet Grey,43990
48,Диван прямой Хевит Velvet Eclipse,47290
